{
  "$schema": "https://json-schema.org/draft/2020-12/schema",
  "$id": "https://schemas.ecp-protocol.org/0.1.0/audit.schema.json",
  "title": "ECP Audit Record",
  "description": "Audit record contract. The default mode is two-auditor operation. A documented fallback to a single auditor is permitted, but the fallback MUST explicitly declare that personal independence is NOT maintained - it must never be disguised or labeled as personally independent. This preserves the distinction between procedural independence and personal/organizational independence.",
  "type": "object",
  "required": [
    "ecp_object",
    "audit_id",
    "protocol_version",
    "schema_version",
    "audit_version",
    "audit_mode",
    "auditors",
    "evidence_reviewed",
    "classification",
    "disagreement",
    "audited_at"
  ],
  "properties": {
    "ecp_object": { "const": "audit" },
    "audit_id": {
      "type": "string",
      "pattern": "^ECP-AUDIT-[A-Za-z0-9][A-Za-z0-9._:-]*$"
    },
    "protocol_version": { "$ref": "#/$defs/semver" },
    "schema_version": { "$ref": "#/$defs/semver" },
    "audit_version": {
      "$ref": "#/$defs/semver",
      "description": "Version of this audit record."
    },
    "audit_mode": {
      "enum": ["two-auditor", "single-auditor-fallback"]
    },
    "auditors": {
      "type": "array",
      "minItems": 1,
      "items": {
        "type": "object",
        "required": ["auditor_id", "role", "independence"],
        "properties": {
          "auditor_id": { "type": "string", "minLength": 1 },
          "role": { "enum": ["primary", "secondary"] },
          "independence": {
            "type": "object",
            "required": ["procedural", "personal"],
            "properties": {
              "procedural": {
                "type": "boolean",
                "description": "Independence of procedure (access rules, order of review, tooling)."
              },
              "personal": {
                "type": "boolean",
                "description": "Independence of person/organization. MUST be false (and declared) whenever the same person executed/collected the evidence."
              },
              "organizational": {
                "type": "boolean",
                "description": "Optional declaration of organizational separation."
              }
            },
            "additionalProperties": false
          }
        },
        "additionalProperties": false
      }
    },
    "fallback_declaration": {
      "type": "object",
      "required": ["personal_independence_maintained", "justification"],
      "properties": {
        "personal_independence_maintained": {
          "const": false,
          "description": "MUST be false: a single-auditor fallback does not maintain personal independence and must not claim it."
        },
        "justification": {
          "type": "string",
          "minLength": 1,
          "description": "Documented reason for the fallback and what residual independence is claimed (e.g. procedural only)."
        }
      },
      "additionalProperties": false
    },
    "evidence_reviewed": {
      "type": "array",
      "minItems": 1,
      "items": {
        "type": "object",
        "required": ["evidence_id", "evidence_hash"],
        "properties": {
          "evidence_id": {
            "type": "string",
            "pattern": "^ECP-EVID-[A-Za-z0-9][A-Za-z0-9._:-]*$"
          },
          "evidence_hash": {
            "$ref": "#/$defs/sha256_hex",
            "description": "SHA-256 over the ECP-CANONICAL-JSON-1.0 serialization of the evidence document (the evidence side holds only the audit id - no circular hashing)."
          }
        },
        "additionalProperties": false
      }
    },
    "classification": {
      "type": "object",
      "required": ["final_label"],
      "properties": {
        "final_label": { "type": "string", "minLength": 1 },
        "per_auditor": {
          "type": "array",
          "items": {
            "type": "object",
            "required": ["auditor_id", "label"],
            "properties": {
              "auditor_id": { "type": "string", "minLength": 1 },
              "label": { "type": "string", "minLength": 1 }
            },
            "additionalProperties": false
          }
        }
      },
      "additionalProperties": false
    },
    "disagreement": {
      "type": "object",
      "required": ["present"],
      "properties": {
        "present": { "type": "boolean" },
        "description": {
          "type": "string",
          "minLength": 1,
          "description": "Required when present = true: what the disagreement was."
        }
      },
      "additionalProperties": false
    },
    "adjudication": {
      "type": "object",
      "required": ["method", "decided_by"],
      "properties": {
        "method": { "type": "string", "minLength": 1 },
        "decided_by": { "type": "string", "minLength": 1 },
        "final_label": { "type": "string", "minLength": 1 }
      },
      "additionalProperties": false,
      "description": "Required when disagreement is present: how the disagreement was resolved."
    },
    "audited_at": { "$ref": "#/$defs/iso8601_utc" },
    "notes": {
      "type": "array",
      "items": { "type": "string" },
      "description": "Optional audit commentary."
    }
  },
  "additionalProperties": false,
  "allOf": [
    {
      "if": {
        "properties": { "audit_mode": { "const": "two-auditor" } }
      },
      "then": {
        "properties": { "auditors": { "minItems": 2 } }
      }
    },
    {
      "if": {
        "properties": { "audit_mode": { "const": "single-auditor-fallback" } }
      },
      "then": {
        "required": ["fallback_declaration"],
        "properties": {
          "auditors": { "maxItems": 1 },
          "fallback_declaration": {
            "properties": {
              "personal_independence_maintained": { "const": false }
            }
          }
        }
      }
    },
    {
      "if": {
        "properties": {
          "disagreement": { "properties": { "present": { "const": true } } }
        }
      },
      "then": {
        "required": ["adjudication"],
        "properties": {
          "disagreement": { "required": ["description"] }
        }
      }
    }
  ],
  "$defs": {
    "semver": {
      "type": "string",
      "pattern": "^(0|[1-9]\\d*)\\.(0|[1-9]\\d*)\\.(0|[1-9]\\d*)(?:-((?:0|[1-9]\\d*|\\d*[a-zA-Z-][0-9a-zA-Z-]*)(?:\\.(?:0|[1-9]\\d*|\\d*[a-zA-Z-][0-9a-zA-Z-]*))*))?(?:\\+([0-9a-zA-Z-]+(?:\\.[0-9a-zA-Z-]+)*))?$"
    },
    "sha256_hex": {
      "type": "string",
      "pattern": "^[0-9a-f]{64}$"
    },
    "iso8601_utc": {
      "type": "string",
      "pattern": "^\\d{4}-\\d{2}-\\d{2}T\\d{2}:\\d{2}:\\d{2}(\\.\\d+)?Z$"
    }
  }
}
