{
  "ecp_object": "audit",
  "audit_id": "ECP-AUDIT-DEMO-0001",
  "protocol_version": "0.1.0",
  "schema_version": "0.1.0",
  "audit_version": "1.0.0",
  "audit_mode": "two-auditor",
  "auditors": [
    {
      "auditor_id": "auditor-demo-a",
      "role": "primary",
      "independence": {
        "procedural": true,
        "personal": true,
        "organizational": true
      }
    },
    {
      "auditor_id": "auditor-demo-b",
      "role": "secondary",
      "independence": {
        "procedural": true,
        "personal": true,
        "organizational": true
      }
    }
  ],
  "evidence_reviewed": [
    {
      "evidence_id": "ECP-EVID-DEMO-0001",
      "evidence_hash": "6dca06518b249b3d7c134ad6504db91d76f3f868da94c53bc546d55b23805370"
    }
  ],
  "classification": {
    "final_label": "CORRECT",
    "per_auditor": [
      {
        "auditor_id": "auditor-demo-a",
        "label": "CORRECT"
      },
      {
        "auditor_id": "auditor-demo-b",
        "label": "CORRECT"
      }
    ]
  },
  "disagreement": {
    "present": false
  },
  "adjudication": {
    "method": "consensus",
    "decided_by": "auditor-demo-a",
    "final_label": "CORRECT"
  },
  "audited_at": "2026-09-09T00:00:06Z",
  "notes": [
    "FORMAT EXAMPLE - simulated audit record. No real evidence was reviewed and no real audit occurred."
  ]
}
